{
  "$schema": "https://json-schema.org/draft/2020-12/schema",
  "$id": "https://researchd.local/schemas/qualification_acceptance.schema.json",
  "title": "QualificationAcceptance",
  "type": "object",
  "additionalProperties": false,
  "required": ["acceptance_id", "gate_id", "candidate_commit", "candidate_tag", "result", "hard_failures", "major_findings", "accepted_evidence_ids", "reviewer", "reviewed_at", "notes"],
  "properties": {
    "acceptance_id": {"type": "string", "pattern": "^qa_[A-Za-z0-9_.-]+$"},
    "gate_id": {"type": "string", "pattern": "^(IQ|DQ|RQ)[0-9]{2}$"},
    "candidate_commit": {"type": "string", "pattern": "^[0-9a-f]{40}$"},
    "candidate_tag": {"type": "string", "pattern": "^v[0-9]+\\.[0-9]+\\.[0-9]+-rc\\.[0-9A-Za-z.-]+$"},
    "result": {"enum": ["PASSED", "FAILED", "INCONCLUSIVE"]},
    "hard_failures": {"type": "array", "items": {"type": "string"}, "uniqueItems": true},
    "major_findings": {"type": "array", "items": {"type": "string"}, "uniqueItems": true},
    "accepted_evidence_ids": {"type": "array", "minItems": 1, "items": {"type": "string", "pattern": "^qe_[A-Za-z0-9_.-]+$"}, "uniqueItems": true},
    "reviewer": {
      "type": "object",
      "additionalProperties": false,
      "required": ["actor_type", "actor_id"],
      "properties": {
        "actor_type": {"enum": ["HUMAN", "SYSTEM"]},
        "actor_id": {"type": "string", "minLength": 1},
        "attestation_sha256": {"type": ["string", "null"], "pattern": "^[0-9a-f]{64}$"}
      }
    },
    "reviewed_at": {"type": "string", "format": "date-time"},
    "notes": {"type": "string"},
    "supersedes_acceptance_id": {"type": ["string", "null"], "pattern": "^qa_[A-Za-z0-9_.-]+$"}
  }
}
